{
  "upload_id": "0190f86f-e0de-7f2a-a24c-0a6abf16ec81",
  "status": "uploading",
  "object_prefix": "archive/v1/0190f870-1111-7f2a-a24c-0a6abf16ec81/0190f870-2222-7f2a-a24c-0a6abf16ec81/0190f86f-e0de-7f2a-a24c-0a6abf16ec81/",
  "multipart_objects": [
    {
      "key": "archive/v1/0190f870-1111-7f2a-a24c-0a6abf16ec81/0190f870-2222-7f2a-a24c-0a6abf16ec81/0190f86f-e0de-7f2a-a24c-0a6abf16ec81/7c2a5f77f3ab6c6d9e011234/sub-a4b73d9e6f12a2b011223344_ses-b9e5cf2f5a74a3f811223344_ser-45fa0d3f9a2e9af111223344_bold.nii.gz",
      "upload_id": "r2_multipart_01J2WBWBZ0P8HMWY0YY6KXJ3E4",
      "part_size": 67108864
    },
    {
      "key": "archive/v1/0190f870-1111-7f2a-a24c-0a6abf16ec81/0190f870-2222-7f2a-a24c-0a6abf16ec81/0190f86f-e0de-7f2a-a24c-0a6abf16ec81/7c2a5f77f3ab6c6d9e011234/sub-a4b73d9e6f12a2b011223344_ses-b9e5cf2f5a74a3f811223344_ser-45fa0d3f9a2e9af111223344_bold.json",
      "upload_id": "r2_multipart_01J2WBWC3SVEC1KH37V5ZK92QH",
      "part_size": 67108864
    }
  ]
}
